{
  "case_id": "CASE_169",
  "created_at": "2026-03-31T18:46:33.115145",
  "source": "abaqus_auto",
  "task": {
    "application": "舱段壁板",
    "load_conditions": {
      "type": "axial_compression",
      "label": "单轴压缩",
      "Nx_kN_per_m": 760.0,
      "Nxy_kN_per_m": 0.0
    },
    "boundary_conditions": {
      "type": "SSSS",
      "label": "四边简支（SSSS）",
      "description": "四条边均按简支处理，适合基准线性屈曲评估。",
      "simply_supported_edges": [
        "X0",
        "X1",
        "Y0",
        "Y1"
      ],
      "clamped_edges": []
    },
    "geometry_envelope": {
      "panel_length_mm": [
        600.0,
        900.0
      ],
      "panel_width_mm": [
        480.0,
        780.0
      ],
      "max_stiffener_height_mm": 42.0
    },
    "material_system": {
      "name": "IM7/8552",
      "density_kg_per_m3": 1570,
      "E1_GPa": 161,
      "E2_GPa": 11.4,
      "G12_GPa": 5.7,
      "nu12": 0.32
    },
    "layup_constraints": {
      "allowed_angles": [
        0,
        45,
        -45,
        90
      ],
      "symmetric": true,
      "balanced": true,
      "min_ratio_per_angle": 0.1
    },
    "stiffener_type": "T",
    "design_targets": {
      "BLF_min": 1.2,
      "primary_objective": "最小重量"
    },
    "screening_preferences": {
      "top_k_candidates": 5
    },
    "candidate_generation_preferences": {
      "total_candidates": 10
    }
  },
  "design": {
    "candidate_id": "C169",
    "source": "DOE",
    "stiffener_type": "T",
    "geometry": {
      "panel_length_mm": 688.672,
      "panel_width_mm": 698.472,
      "skin_thickness_mm": 1.91,
      "pitch_mm": 124.94,
      "stiffener_height_mm": 31.24,
      "web_thickness_mm": 2.465,
      "flange_width_mm": 19.678,
      "flange_thickness_mm": 2.654
    },
    "layup": {
      "template_name": "SHEAR_14",
      "skin_layup": "[45/0/-45/90/-45/0/45]s",
      "skin_f0": 0.286,
      "skin_f45": 0.571,
      "skin_f90": 0.143,
      "ply_count": 14
    },
    "material_system": {
      "name": "IM7/8552",
      "density_kg_per_m3": 1570,
      "E1_GPa": 161,
      "E2_GPa": 11.4,
      "G12_GPa": 5.7,
      "nu12": 0.32
    },
    "load_conditions": {
      "type": "axial_compression",
      "label": "单轴压缩",
      "Nx_kN_per_m": 760.0,
      "Nxy_kN_per_m": 0.0
    },
    "boundary_conditions": {
      "type": "SSSS",
      "label": "四边简支（SSSS）",
      "description": "四条边均按简支处理，适合基准线性屈曲评估。",
      "simply_supported_edges": [
        "X0",
        "X1",
        "Y0",
        "Y1"
      ],
      "clamped_edges": []
    },
    "design_targets": {
      "BLF_min": 1.2,
      "primary_objective": "最小重量"
    },
    "rule_check": {
      "is_valid": true,
      "errors": [],
      "suggestions": [],
      "details": {
        "panel_length_mm_ok": true,
        "panel_width_mm_ok": true,
        "skin_thickness_mm_ok": true,
        "pitch_mm_ok": true,
        "stiffener_height_mm_ok": true,
        "web_thickness_mm_ok": true,
        "flange_width_mm_ok": true,
        "flange_thickness_mm_ok": true,
        "symmetric": true,
        "balanced": true,
        "min_ratio_ok": true,
        "height_pitch_ratio_ok": true,
        "height_thickness_ratio_ok": true,
        "solver_skin_thickness_ok": true,
        "solver_pitch_ok": true,
        "solver_height_ok": true,
        "solver_flange_width_ok": true,
        "solver_height_pitch_band_ok": true
      }
    },
    "surrogate_BLF": null,
    "rationale": "DOE 拉丁超立方探索生成 | 材料=IM7/8552 | 铺层=SHEAR_14"
  },
  "abaqus_results": {
    "candidate_id": "C169",
    "status": "success",
    "retry_count": 0,
    "BLF_global": 0.093819,
    "BLF_local": 0.09813,
    "failure_mode": "整体屈曲",
    "max_displacement_mm": 1.0,
    "weight_kg_per_m2": 4.741598,
    "verdict": "不通过",
    "abaqus_odb": "D:\\Project\\VS_Code\\CSDM\\data\\abaqus_runs\\C169\\C169.odb",
    "abaqus_inp": "D:\\Project\\VS_Code\\CSDM\\data\\abaqus_runs\\C169\\C169.inp",
    "visualization_json": "D:\\Project\\VS_Code\\CSDM\\data\\abaqus_runs\\C169\\C169_mode1.json",
    "artifact_dir": "D:\\Project\\VS_Code\\CSDM\\data\\abaqus_runs\\C169",
    "error_type": null,
    "error_log": null,
    "mode_eigenvalues": [
      0.093819,
      0.09813,
      0.10034,
      0.10613,
      0.10843
    ],
    "load_summary": "单轴压缩：Nx=760.0 kN/m",
    "boundary_summary": "四边简支（SSSS）",
    "diagnosis_summary": "历史结果已迁移，当前结论为“不通过”。"
  },
  "verdict": "不通过",
  "surrogate_BLF_error_pct": null,
  "fem_agent_retry_count": 0
}