{
  "case_id": "CASE_327",
  "created_at": "2026-04-03T08:05:10.059282",
  "source": "abaqus_auto",
  "task": {
    "application": "机翼下蒙皮壁板",
    "load_conditions": {
      "type": "compression_shear",
      "label": "压剪组合",
      "Nx_kN_per_m": 900.0,
      "Nxy_kN_per_m": 180.0
    },
    "boundary_conditions": {
      "type": "SSCC",
      "label": "X 向简支 + Y 向固支（SSCC）",
      "description": "X0/X1 两边简支，Y0/Y1 两边固支。",
      "simply_supported_edges": [
        "X0",
        "X1"
      ],
      "clamped_edges": [
        "Y0",
        "Y1"
      ]
    },
    "geometry_envelope": {
      "panel_length_mm": [
        600.0,
        800.0
      ],
      "panel_width_mm": [
        500.0,
        700.0
      ],
      "max_stiffener_height_mm": 50.0
    },
    "material_system": {
      "name": "T300/5208",
      "density_kg_per_m3": 1600,
      "E1_GPa": 181,
      "E2_GPa": 10.3,
      "G12_GPa": 7.17,
      "nu12": 0.28,
      "material_key": "T300_5208",
      "is_user_specified": false
    },
    "layup_constraints": {
      "allowed_angles": [
        0,
        45,
        -45,
        90
      ],
      "symmetric": true,
      "balanced": true,
      "min_ratio_per_angle": 0.1
    },
    "stiffener_type": "T",
    "design_targets": {
      "BLF_min": 1.35,
      "primary_objective": "最小重量"
    },
    "candidate_generation_preferences": {
      "total_candidates": 10
    },
    "screening_preferences": {
      "top_k_candidates": 5
    }
  },
  "design": {
    "candidate_id": "C327",
    "source": "DOE",
    "stiffener_type": "T",
    "geometry": {
      "panel_length_mm": 848.364,
      "panel_width_mm": 759.317,
      "skin_thickness_mm": 1.332,
      "pitch_mm": 118.082,
      "stiffener_height_mm": 26.06,
      "web_thickness_mm": 2.328,
      "flange_width_mm": 12.922,
      "flange_thickness_mm": 2.486
    },
    "layup": {
      "template_name": "SHEAR_14",
      "skin_layup": "[45/0/-45/90/-45/0/45]s",
      "skin_f0": 0.286,
      "skin_f45": 0.571,
      "skin_f90": 0.143,
      "ply_count": 14
    },
    "material_system": {
      "name": "IM7/8552",
      "density_kg_per_m3": 1570.0,
      "E1_GPa": 161.0,
      "E2_GPa": 11.4,
      "G12_GPa": 5.7,
      "nu12": 0.32,
      "material_key": "IM7_8552"
    },
    "load_conditions": {
      "type": "compression_shear",
      "label": "压剪组合",
      "Nx_kN_per_m": 900.0,
      "Nxy_kN_per_m": 180.0
    },
    "boundary_conditions": {
      "type": "SSCC",
      "label": "X 向简支 + Y 向固支（SSCC）",
      "description": "X0/X1 两边简支，Y0/Y1 两边固支。",
      "simply_supported_edges": [
        "X0",
        "X1"
      ],
      "clamped_edges": [
        "Y0",
        "Y1"
      ]
    },
    "design_targets": {
      "BLF_min": 1.35,
      "primary_objective": "最小重量"
    },
    "rule_check": {
      "is_valid": true,
      "errors": [],
      "suggestions": [],
      "details": {
        "panel_length_mm_ok": true,
        "panel_width_mm_ok": true,
        "skin_thickness_mm_ok": true,
        "pitch_mm_ok": true,
        "stiffener_height_mm_ok": true,
        "web_thickness_mm_ok": true,
        "flange_width_mm_ok": true,
        "flange_thickness_mm_ok": true,
        "symmetric": true,
        "balanced": true,
        "min_ratio_ok": true,
        "height_pitch_ratio_ok": true,
        "height_thickness_ratio_ok": true,
        "solver_skin_thickness_ok": true,
        "solver_pitch_ok": true,
        "solver_height_ok": true,
        "solver_flange_width_ok": true,
        "solver_height_pitch_band_ok": true
      }
    },
    "surrogate_BLF": 0.042,
    "rationale": "DOE 拉丁超立方探索生成 | 材料=IM7/8552 | 铺层=SHEAR_14"
  },
  "abaqus_results": {
    "candidate_id": "C327",
    "status": "success",
    "retry_count": 0,
    "BLF_global": 0.020596,
    "BLF_local": 0.028136,
    "failure_mode": "整体屈曲",
    "max_displacement_mm": 1.0,
    "weight_kg_per_m2": 3.242404,
    "verdict": "不通过",
    "abaqus_odb": "D:\\Project\\VS_Code\\CSDM_panel\\data\\abaqus_runs\\C327\\C327.odb",
    "abaqus_inp": "D:\\Project\\VS_Code\\CSDM_panel\\data\\abaqus_runs\\C327\\C327.inp",
    "visualization_json": "D:\\Project\\VS_Code\\CSDM_panel\\data\\abaqus_runs\\C327\\C327_mode1.json",
    "artifact_dir": "D:\\Project\\VS_Code\\CSDM_panel\\data\\abaqus_runs\\C327",
    "error_type": null,
    "error_log": null,
    "mode_eigenvalues": [
      0.020596,
      0.028136,
      0.031958,
      0.034147,
      0.037453,
      0.039657,
      0.039952,
      0.041483
    ],
    "load_summary": "压剪组合：Nx=900.0 kN/m，Nxy=180.0 kN/m",
    "boundary_summary": "X 向简支 + Y 向固支（SSCC）",
    "diagnosis_summary": "线性屈曲校核已完成，前 1 个负特征值模态已跳过，按第 1 阶正特征值判定，当前结论为“不通过”。"
  },
  "verdict": "不通过",
  "surrogate_BLF_error_pct": 103.923,
  "fem_agent_retry_count": 0
}